{"$schema":"https://json-schema.org/draft/2020-12/schema","title":"Learning paths","type":"object","additionalProperties":false,"required":["schema_version","status","notice","paths"],"properties":{"schema_version":{"type":"string"},"status":{"enum":["draft","stable"]},"notice":{"type":"string","minLength":1},"paths":{"type":"array","items":{"type":"object","additionalProperties":false,"required":["id","name","audiences","goal","steps"],"properties":{"id":{"type":"string","pattern":"^PATH-[0-9]{3}$"},"name":{"type":"object","additionalProperties":false,"required":["zh","en"],"properties":{"zh":{"type":"string","minLength":1},"en":{"type":"string","minLength":1}}},"audiences":{"type":"array","minItems":1,"uniqueItems":true,"items":{"enum":["youth","teachers","families"]}},"goal":{"type":"string","minLength":10},"steps":{"type":"array","minItems":2,"uniqueItems":true,"items":{"type":"string","pattern":"^(AI|BIZ|PRO|SOC)-[A-Z]{3}-[0-9]{3}$"}}}}}}}
